{
  "stock": {
    "slug": "greyboard-1500",
    "name": {
      "en": "Greyboard 1.5 mm",
      "es": "Cartón gris 1.5 mm",
      "fr": "Carton gris 1,5 mm",
      "pt": "Papelão cinza 1,5 mm"
    },
    "class": "chipboard",
    "fiber": [
      "recycled-fibre"
    ],
    "finish": "uncoated",
    "color": "#8f8a80",
    "grain": "long"
  },
  "physical": {
    "gsm": {
      "value": 1100,
      "status": "estimated",
      "basis": "≈ 0.73 g/cm³ recycled greyboard × 1.5 mm [E]"
    },
    "caliper_um": {
      "value": 1500,
      "status": "estimated",
      "basis": "nominal 1.5 mm board (brief) [E]"
    },
    "E_md_gpa": {
      "value": 2.5,
      "status": "estimated",
      "basis": "recycled board, low-modulus mixed fibre [E]"
    },
    "E_cd_gpa": {
      "value": 1.8,
      "status": "estimated",
      "basis": "weak grain in multi-cylinder board, MD/CD ≈ 1.4 [E]"
    },
    "nu": {
      "value": 0.293,
      "status": "estimated",
      "basis": "√(ν12·ν21) = 0.293 for machine-made paper (Baum et al. 1981)"
    },
    "bending_stiffness_mNm": {
      "md": null,
      "cd": null,
      "method": null
    },
    "crease_length_scale_t": {
      "value": 75,
      "status": "estimated",
      "basis": "scored board: L* = 50–100 t (memo §a3, Beex & Peerlings 2009 qualitative); mid value [E]"
    },
    "crease_yield_deg": {
      "value": 35,
      "status": "estimated",
      "basis": "rest opening 27–43° after creasing (Lechenault 2014, Mylar); board unmeasured [E]"
    },
    "tear_strain": {
      "value": 0.01,
      "status": "estimated",
      "basis": "board grades, low elongation [E]"
    },
    "friction": {
      "value": 0.5,
      "status": "estimated",
      "basis": "kraft on kraft 0.3–0.6 (rsE §a3) [E]"
    }
  },
  "fabrication": {
    "min_feature_mm": 3.0,
    "score": "V-groove or score deeply before folding; book board is usually not folded",
    "laser": null,
    "plotter": null,
    "glue": [
      "pva"
    ]
  },
  "appearance": {
    "front": "#8f8a80",
    "back": "#8f8a80",
    "translucency": 0.0,
    "roughness": 0.85
  },
  "derived": {
    "areal_density": 0.0011,
    "thickness": 1.5,
    "E_md": 2500000000.0,
    "E_cd": 1800000000.0,
    "nu": 0.293,
    "D_md": 769156000.0,
    "D_cd": 553793000.0,
    "crease_k": 5801340.0,
    "crease_yield_deg": 35.0,
    "crease_set_rate": 0.5,
    "score_factor": 0.35,
    "perf_factor": 0.25,
    "tear_strain": 0.01,
    "friction": 0.5,
    "collision_thickness": 1.5,
    "G12": 820951000.0,
    "score_yield_deg": 12.25
  },
  "derived_basis": "pliego.stock.derive v1",
  "provenance": {
    "author": "Innovaciones MADFAM",
    "license": "CERN-OHL-W-2.0",
    "sources": [
      "Baum, Habeger & Fleischman 1981, Measurement of the orthotropic elastic constants of paper — https://bioresources.cnr.ncsu.edu/resources/measurement-of-the-orthotropic-elastic-constants-of-paper/",
      "Pliego research memo rsE (2026-10-10) §a3/§b — engineering estimates [E]; scored board L* = 50–100 t (Beex & Peerlings 2009, qualitative) — https://orbilu.uni.lu/handle/10993/17431"
    ]
  }
}
