{
  "stock": {
    "slug": "sbs-board-350",
    "name": {
      "en": "Solid bleached board (SBS) 350 g/m²",
      "es": "Cartulina sólida blanqueada (SBS) 350 g/m²",
      "fr": "Carton blanchi massif (SBS) 350 g/m²",
      "pt": "Cartão sólido branqueado (SBS) 350 g/m²"
    },
    "class": "cardstock",
    "fiber": [
      "wood-pulp"
    ],
    "finish": "pigment-coated one side",
    "color": "#f7f7f4",
    "grain": "long"
  },
  "physical": {
    "gsm": {
      "value": 350,
      "status": "estimated",
      "basis": "grade designation band 300–400 g/m² (brief) [E]"
    },
    "caliper_um": {
      "value": 430,
      "status": "estimated",
      "basis": "≈ 0.81 g/cm³ solid bleached board [E]"
    },
    "E_md_gpa": {
      "value": 5.5,
      "status": "estimated",
      "basis": "bleached chemical-pulp board, rsE §b band 4.5–6.5 GPa [E]"
    },
    "E_cd_gpa": {
      "value": 2.4,
      "status": "estimated",
      "basis": "MD/CD ≈ 2.3 (Baum et al. 1981) [E]"
    },
    "nu": {
      "value": 0.293,
      "status": "estimated",
      "basis": "√(ν12·ν21) = 0.293 for machine-made paper (Baum et al. 1981)"
    },
    "bending_stiffness_mNm": {
      "md": null,
      "cd": null,
      "method": null
    },
    "crease_length_scale_t": {
      "value": 75,
      "status": "estimated",
      "basis": "scored board: L* = 50–100 t (memo §a3, Beex & Peerlings 2009 qualitative); mid value [E]"
    },
    "crease_yield_deg": {
      "value": 35,
      "status": "estimated",
      "basis": "rest opening 27–43° after creasing (Lechenault 2014, Mylar); board unmeasured [E]"
    },
    "tear_strain": {
      "value": 0.015,
      "status": "estimated",
      "basis": "board grades, low elongation [E]"
    },
    "friction": {
      "value": 0.4,
      "status": "estimated",
      "basis": "kraft on kraft 0.3–0.6 (rsE §a3) [E]"
    }
  },
  "fabrication": {
    "min_feature_mm": 1.5,
    "score": "required: crease-rule every fold",
    "laser": null,
    "plotter": null,
    "glue": [
      "pva",
      "hot-melt"
    ],
    "perforation": {
      "cut_mm": 3.0,
      "bridge_mm": 1.0
    }
  },
  "appearance": {
    "front": "#f7f7f4",
    "back": "#f3f2ee",
    "translucency": 0.0,
    "roughness": 0.85
  },
  "derived": {
    "areal_density": 0.00035,
    "thickness": 0.43,
    "E_md": 5500000000.0,
    "E_cd": 2400000000.0,
    "nu": 0.293,
    "D_md": 39862900.0,
    "D_cd": 17394700.0,
    "crease_k": 816514.0,
    "crease_yield_deg": 35.0,
    "crease_set_rate": 0.5,
    "score_factor": 0.35,
    "perf_factor": 0.25,
    "tear_strain": 0.015,
    "friction": 0.4,
    "collision_thickness": 0.43,
    "G12": 1406040000.0,
    "score_yield_deg": 12.25,
    "perf_cut_mm": 3.0,
    "perf_bridge_mm": 1.0
  },
  "derived_basis": "pliego.stock.derive v1",
  "provenance": {
    "author": "Innovaciones MADFAM",
    "license": "CERN-OHL-W-2.0",
    "sources": [
      "Baum, Habeger & Fleischman 1981, Measurement of the orthotropic elastic constants of paper — https://bioresources.cnr.ncsu.edu/resources/measurement-of-the-orthotropic-elastic-constants-of-paper/",
      "Pliego research memo rsE (2026-10-10) §a3/§b — engineering estimates [E]; scored board L* = 50–100 t (Beex & Peerlings 2009, qualitative) — https://orbilu.uni.lu/handle/10993/17431"
    ]
  }
}
